{
  "$schema": "https://json-schema.org/draft/2020-12/schema",
  "$id": "https://mazatzalhiking.com/schema/graph.schema.json",
  "title": "Mazatzal trail graph",
  "description": "Curated graph of junctions and named legs. Generated by the curation tool; see docs/trail-graph-schema.md. Condition observations live in a separate file and are never regenerated.",
  "type": "object",
  "required": ["version", "trails", "nodes", "segments"],
  "additionalProperties": false,
  "properties": {
    "version": { "type": "integer", "minimum": 1 },
    "generated": { "type": "string", "format": "date" },
    "trails": { "type": "array", "items": { "$ref": "#/$defs/trail" } },
    "nodes": { "type": "array", "items": { "$ref": "#/$defs/node" } },
    "segments": { "type": "array", "items": { "$ref": "#/$defs/segment" } },
    "features": { "type": "array", "items": { "$ref": "#/$defs/feature" } },
    "retired": {
      "description": "Tombstones for ids withdrawn from use, so already-shared route URLs can be repaired rather than silently changing meaning. Never reissue a retired id.",
      "type": "array",
      "items": { "$ref": "#/$defs/retired" }
    },
    "islands": {
      "description": "Components deliberately left unconnected, each with the reason no walked route reaches them. An undeclared split is an error.",
      "type": "array",
      "items": { "$ref": "#/$defs/island" }
    }
  },
  "$defs": {
    "id": {
      "description": "Assigned once by the curation tool from the next free code; never derived from geometry or ordering. Each entity type has its own id space. Ids in a space must be unique case-insensitively: segment geometry lives at geometry/<id>.json, and case-insensitive filesystems collapse 0A and 0a onto one file, destroying the older segment's line. See decision 1.",
      "type": "string",
      "pattern": "^[0-9A-Za-z]{2,4}$"
    },
    "trail": {
      "type": "object",
      "required": ["id", "name", "kind", "slug"],
      "additionalProperties": false,
      "properties": {
        "id": { "$ref": "#/$defs/id" },
        "name": { "type": "string", "minLength": 1 },
        "slug": {
          "description": "The trail page lives at /trails/<slug>/. Authored, not derived from the name: search indexes and shared links hold these URLs, so a rename must never move a page. Assigned once from the name at the time; unique across trails.",
          "type": "string",
          "pattern": "^[a-z0-9]+(-[a-z0-9]+)*$"
        },
        "code": {
          "description": "Forest Service trail number or road number, where one exists.",
          "type": ["string", "null"]
        },
        "kind": { "enum": ["trail", "road"] }
      }
    },
    "node": {
      "description": "A junction or trailhead. Nodes are the connectivity structure and are the only thing that splits a segment.",
      "type": "object",
      "required": ["id", "name", "kind", "lat", "lon"],
      "additionalProperties": false,
      "properties": {
        "id": { "$ref": "#/$defs/id" },
        "name": { "type": "string", "minLength": 1 },
        "kind": { "enum": ["junction", "trailhead"] },
        "lat": { "type": "number", "minimum": -90, "maximum": 90 },
        "lon": { "type": "number", "minimum": -180, "maximum": 180 },
        "ele_ft": { "type": ["number", "null"] }
      }
    },
    "segment": {
      "description": "A named leg of tread between two nodes. Geometry runs from -> to; the reverse direction swaps gain_ft and loss_ft.",
      "type": "object",
      "required": ["id", "name", "from", "to", "trails", "miles", "gain_ft", "loss_ft", "geometry"],
      "additionalProperties": false,
      "properties": {
        "id": { "$ref": "#/$defs/id" },
        "name": {
          "description": "Shown in the builder, so it must read as a place: 'Davenport Trailhead to Sheep Creek Junction'.",
          "type": "string",
          "minLength": 1
        },
        "from": { "$ref": "#/$defs/id" },
        "to": { "$ref": "#/$defs/id" },
        "trails": {
          "description": "Parent trails in display precedence. trails[0] is the local name a hiker reads off the sign; long-distance overlays follow. Multiple entries where named trails share tread.",
          "type": "array",
          "minItems": 1,
          "items": { "$ref": "#/$defs/id" }
        },
        "miles": { "type": "number", "exclusiveMinimum": 0 },
        "gain_ft": {
          "description": "Gain travelling from -> to. Computed by simplifying the elevation profile first, then summing, so the value is direction-symmetric and the reverse is exactly loss_ft.",
          "type": "number",
          "minimum": 0
        },
        "loss_ft": { "type": "number", "minimum": 0 },
        "geometry": {
          "description": "Path to this segment's full-resolution geometry, fetched only at export time. Point data never appears inline.",
          "type": "string"
        },
        "sources": {
          "description": "The recorded tracks this leg was derived from. Walked-it-myself provenance is the point of the project and must survive into the graph.",
          "type": "array",
          "items": {
            "type": "object",
            "required": ["file", "date"],
            "additionalProperties": false,
            "properties": {
              "file": { "type": "string" },
              "date": { "type": "string", "format": "date" }
            }
          }
        }
      }
    },
    "feature": {
      "description": "A point of interest. Features do NOT split segments; they ride along one at a position, which is what a later split-here action resolves to.",
      "type": "object",
      "required": ["id", "name", "kind", "lat", "lon"],
      "additionalProperties": false,
      "properties": {
        "id": { "$ref": "#/$defs/id" },
        "name": { "type": "string", "minLength": 1 },
        "kind": { "enum": ["water", "camp", "cabin", "viewpoint", "ruin", "ford"] },
        "lat": { "type": "number", "minimum": -90, "maximum": 90 },
        "lon": { "type": "number", "minimum": -180, "maximum": 180 },
        "ele_ft": { "type": ["number", "null"] },
        "on": {
          "description": "Derived at build time by projecting lat/lon onto a segment. Coordinates are the authored truth; this projection is a convenience and is recomputed whenever geometry changes.",
          "$ref": "#/$defs/id"
        },
        "at": {
          "description": "Derived. Fraction along the segment's geometry, from its `from` end.",
          "type": "number",
          "minimum": 0,
          "maximum": 1
        }
      }
    },
    "retired": {
      "type": "object",
      "required": ["id", "on", "reason"],
      "additionalProperties": false,
      "properties": {
        "id": { "$ref": "#/$defs/id" },
        "superseded_by": {
          "description": "Where the retired id's ground went, so a stale route URL can be repaired instead of dropped.",
          "type": "array",
          "items": { "$ref": "#/$defs/id" }
        },
        "on": { "type": "string", "format": "date" },
        "reason": { "type": "string", "minLength": 1 }
      }
    },
    "island": {
      "description": "A component of the network deliberately not reachable on foot from the rest of it. Declaring one is a reviewed act, like retiring an id: the validator treats an undeclared split as an error, because it is almost always a missed junction rather than real geography.",
      "type": "object",
      "required": ["nodes", "on", "reason"],
      "additionalProperties": false,
      "properties": {
        "nodes": {
          "description": "Every node in the isolated component, exactly. If the component later grows or shrinks the declaration stops matching and must be re-reviewed.",
          "type": "array",
          "minItems": 1,
          "items": { "$ref": "#/$defs/id" }
        },
        "on": { "type": "string", "format": "date" },
        "reason": {
          "description": "Why no walked route reaches it — surfaced by the builder when someone lands on this component.",
          "type": "string",
          "minLength": 1
        }
      }
    }
  }
}
